{
  "schemaVersion": "1.0.0",
  "scenario": {
    "scenarioVersion": "1.0.0",
    "id": "LOD-500K",
    "population": 500000,
    "visibilityPercent": 100,
    "width": 1920,
    "height": 1080,
    "renderScale": 1,
    "durationSeconds": 20,
    "warmupSeconds": 5,
    "seed": 1511508451,
    "fixedTimestepSeconds": 0.016666666666666666,
    "cameraPath": "default-orbit-static-v1",
    "input": "disabled",
    "lodMode": "auto",
    "workgroupSize": 128
  },
  "source": {
    "commit": "8b9ff88",
    "dirty": false
  },
  "environment": {
    "recordedAt": "2026-08-30T16:17:35.962Z",
    "os": "Windows 10.0.26200",
    "browser": "Google Chrome 151.0.7922.174 (Playwright channel chrome, headless)",
    "adapter": "nvidia turing",
    "timestampQuery": true,
    "powerPreference": "high-performance"
  },
  "stages": {
    "loadingAndCompilationMs": 2281.759,
    "warmupSeconds": 5,
    "measurementSeconds": 20,
    "postMeasurementReadback": true,
    "overlayDuringMeasurement": false
  },
  "samples": {
    "frameIntervalMs": [
      16.600000381469727,
      16.799999237060547,
      16.600000381469727,
      16.700000762939453,
      17.100000381469727,
      16.299999237060547,
      16.5,
      16.899999618530273,
      16.5,
      16.600000381469727,
      17,
      16.399999618530273,
      16.799999237060547,
      16.799999237060547,
      16.399999618530273,
      16.700000762939453,
      16.700000762939453,
      16.5,
      16.700000762939453,
      16.799999237060547,
      16.600000381469727,
      16.899999618530273,
      16.600000381469727,
      16.5,
      16.600000381469727,
      16.799999237060547,
      16.700000762939453,
      16.600000381469727,
      16.899999618530273,
      16.399999618530273,
      16.700000762939453,
      16.899999618530273,
      16.399999618530273,
      16.899999618530273,
      16.399999618530273,
      16.700000762939453,
      16.799999237060547,
      16.600000381469727,
      16.700000762939453,
      16.5,
      17.299999237060547,
      16,
      16.700000762939453,
      16.700000762939453,
      16.600000381469727,
      16.799999237060547,
      16.5,
      16.799999237060547,
      16.700000762939453,
      16.600000381469727,
      16.600000381469727,
      16.700000762939453,
      16.600000381469727,
      16.799999237060547,
      16.600000381469727,
      16.700000762939453,
      16.700000762939453,
      16.600000381469727,
      16.799999237060547,
      16.5,
      16.700000762939453,
      16.799999237060547,
      16.600000381469727,
      16.700000762939453,
      16.600000381469727,
      16.799999237060547,
      16.600000381469727,
      16.700000762939453,
      16.700000762939453,
      16.899999618530273,
      16.299999237060547,
      16.600000381469727,
      16.700000762939453,
      16.700000762939453,
      16.700000762939453,
      16.600000381469727,
      17.600000381469727,
      15.699999809265137,
      16.700000762939453,
      16.700000762939453,
      16.700000762939453,
      16.700000762939453,
      16.600000381469727,
      16.700000762939453,
      16.600000381469727,
      16.700000762939453,
      16.600000381469727,
      16.799999237060547,
      16.600000381469727,
      16.700000762939453,
      16.600000381469727,
      16.700000762939453,
      16.700000762939453,
      16.700000762939453,
      16.600000381469727,
      16.700000762939453,
      16.600000381469727,
      16.700000762939453,
      16.700000762939453,
      16.600000381469727,
      16.700000762939453,
      16.700000762939453,
      16.600000381469727,
      16.899999618530273,
      16.5,
      16.600000381469727,
      16.700000762939453,
      16.700000762939453,
      16.799999237060547,
      16.600000381469727,
      16.700000762939453,
      16.5,
      16.799999237060547,
      16.5,
      16.799999237060547,
      16.600000381469727,
      16.700000762939453,
      16.700000762939453,
      16.600000381469727,
      16.700000762939453,
      16.600000381469727,
      16.700000762939453,
      16.799999237060547,
      16.700000762939453,
      16.5,
      16.700000762939453,
      16.700000762939453,
      16.600000381469727,
      16.700000762939453,
      16.5,
      16.799999237060547,
      16.700000762939453,
      16.700000762939453,
      16.600000381469727,
      16.600000381469727,
      16.799999237060547,
      16.600000381469727,
      16.899999618530273,
      16.5,
      16.700000762939453,
      16.5,
      16.899999618530273,
      16.600000381469727,
      16.600000381469727,
      16.700000762939453,
      16.600000381469727,
      16.799999237060547,
      16.5,
      16.700000762939453,
      16.600000381469727,
      16.700000762939453,
      16.700000762939453,
      16.700000762939453,
      16.700000762939453,
      16.600000381469727,
      16.799999237060547,
      16.600000381469727,
      16.5,
      16.799999237060547,
      16.899999618530273,
      16.399999618530273,
      16.700000762939453,
      16.799999237060547,
      16.5,
      16.600000381469727,
      16.899999618530273,
      16.600000381469727,
      16.600000381469727,
      16.600000381469727,
      33.400001525878906,
      33.20000076293945,
      16.799999237060547,
      16.600000381469727,
      16.799999237060547,
      16.5,
      17,
      16.399999618530273,
      16.600000381469727,
      16.700000762939453,
      16.600000381469727,
      16.700000762939453,
      16.700000762939453,
      16.700000762939453,
      16.600000381469727,
      16.700000762939453,
      16.700000762939453,
      16.700000762939453,
      16.600000381469727,
      16.799999237060547,
      16.700000762939453,
      16.899999618530273,
      16.399999618530273,
      16.600000381469727,
      16.600000381469727,
      16.700000762939453,
      16.600000381469727,
      16.700000762939453,
      16.700000762939453,
      16.700000762939453,
      16.700000762939453,
      16.600000381469727,
      16.700000762939453,
      17.100000381469727,
      16.200000762939453,
      16.700000762939453,
      16.700000762939453,
      16.700000762939453,
      16.600000381469727,
      16.600000381469727,
      16.799999237060547,
      16.600000381469727,
      16.600000381469727,
      16.700000762939453,
      16.600000381469727,
      16.700000762939453,
      16.700000762939453,
      16.700000762939453,
      16.799999237060547,
      16.600000381469727,
      16.5,
      16.899999618530273,
      16.5,
      16.700000762939453,
      16.600000381469727,
      16.700000762939453,
      16.700000762939453,
      16.799999237060547,
      16.5,
      16.600000381469727,
      16.799999237060547,
      16.600000381469727,
      16.700000762939453,
      16.600000381469727,
      16.600000381469727,
      16.799999237060547,
      16.600000381469727,
      16.600000381469727,
      16.700000762939453,
      16.899999618530273,
      16.600000381469727,
      16.5,
      16.799999237060547,
      16.700000762939453,
      16.700000762939453,
      16.5,
      16.899999618530273,
      16.5,
      16.700000762939453,
      16.600000381469727,
      16.600000381469727,
      16.700000762939453,
      16.700000762939453,
      16.600000381469727,
      16.700000762939453,
      16.700000762939453,
      16.899999618530273,
      16.600000381469727,
      16.5,
      16.700000762939453,
      16.700000762939453,
      16.600000381469727,
      16.700000762939453,
      16.600000381469727,
      16.799999237060547,
      16.5,
      16.700000762939453,
      16.700000762939453,
      16.600000381469727,
      16.600000381469727,
      16.799999237060547,
      16.700000762939453,
      16.600000381469727,
      16.600000381469727,
      16.700000762939453,
      16.700000762939453,
      16.600000381469727,
      16.700000762939453,
      16.700000762939453,
      16.700000762939453,
      16.600000381469727,
      16.700000762939453,
      16.700000762939453,
      16.700000762939453,
      16.5,
      16.700000762939453,
      16.700000762939453,
      16.700000762939453,
      16.700000762939453,
      16.5,
      16.700000762939453,
      16.700000762939453,
      16.799999237060547,
      16.600000381469727,
      16.799999237060547,
      16.700000762939453,
      16.399999618530273,
      16.700000762939453,
      16.799999237060547,
      16.5,
      16.700000762939453,
      16.700000762939453,
      16.799999237060547,
      16.700000762939453,
      16.600000381469727,
      16.5,
      16.700000762939453,
      16.700000762939453,
      16.600000381469727,
      16.899999618530273,
      16.600000381469727,
      16.600000381469727,
      17,
      16.399999618530273,
      16.700000762939453,
      16.600000381469727,
      16.700000762939453,
      16.600000381469727,
      16.700000762939453,
      16.700000762939453,
      16.600000381469727,
      16.700000762939453,
      16.600000381469727,
      16.899999618530273,
      16.399999618530273,
      16.700000762939453,
      16.600000381469727,
      16.799999237060547,
      16.5,
      16.700000762939453,
      16.899999618530273,
      16.399999618530273,
      16.799999237060547,
      16.700000762939453,
      16.5,
      16.700000762939453,
      16.700000762939453,
      16.700000762939453,
      16.700000762939453,
      16.700000762939453,
      16.600000381469727,
      16.700000762939453,
      16.700000762939453,
      16.700000762939453,
      16.600000381469727,
      16.600000381469727,
      16.700000762939453,
      16.700000762939453,
      16.600000381469727,
      16.799999237060547,
      16.5,
      16.799999237060547,
      16.899999618530273,
      16.299999237060547,
      16.799999237060547,
      16.799999237060547,
      16.5,
      16.799999237060547,
      16.600000381469727,
      16.700000762939453,
      16.5,
      33.29999923706055,
      16.899999618530273,
      16.600000381469727,
      16.600000381469727,
      16.700000762939453,